{
  "invoice_id": "INV-SA-2026-000123",
  "electronic_id": "ZATCASA2026041900000A1B2C3",
  "document_kind": "tax_invoice",
  "invoice_date": "2026-04-10",
  "due_date": "2026-05-10",
  "currency": "SAR",
  "seller": {
    "name_ar": "شركة النور للتجارة المحدودة",
    "name_en": "Al-Noor Trading Co. Ltd",
    "tax_id": "300123456700003",
    "commercial_registration": "1010123456",
    "address_ar": "الرياض، حي العليا، ص.ب 1234",
    "address_en": "Riyadh, Olaya District, P.O. Box 1234",
    "country": "SA"
  },
  "buyer": {
    "name_ar": "شركة الخليج للاستشارات",
    "name_en": "Gulf Consulting Co.",
    "tax_id": "300987654300003",
    "country": "SA"
  },
  "line_items": [
    {
      "line_number": 1,
      "description_ar": "خدمات استشارية - أبريل 2026",
      "description_en": "Consulting services - April 2026",
      "sku": "CONS-APR26",
      "quantity": 1,
      "unit_of_measure": "EA",
      "unit_price": 10000.00,
      "vat_amount": 1500.00,
      "line_total": 11500.00
    }
  ],
  "totals": {
    "subtotal": 10000.00,
    "vat_amount": 1500.00,
    "gross": 11500.00
  },
  "vat_category": "FI",
  "vat_rate_percent": 15,
  "tax_authority": "ZATCA",
  "country": "SA",
  "signature": {
    "kind": "digital",
    "signer_name": "Al-Noor Trading Co. Ltd",
    "signed_date": "2026-04-10",
    "certificate_hash": "1a2b3c4d5e6f7a8b9c0d1e2f3a4b5c6d7e8f9a0b1c2d3e4f5a6b7c8d9e0f1a2b"
  },
  "source_document": {
    "path": "data/arabic/invoices/INV-SA-2026-000123.pdf",
    "sha256": "2b3c4d5e6f7a8b9c0d1e2f3a4b5c6d7e8f9a0b1c2d3e4f5a6b7c8d9e0f1a2b3c",
    "format": "PDF"
  },
  "metadata": {
    "id": "INV-SA-2026-000123",
    "created_at": "2026-04-10T14:30:00+03:00",
    "version": "1.2.0",
    "source": "data/arabic/invoices/INV-SA-2026-000123.pdf"
  }
}
